{
  "mode": "swot",
  "subject": "Launching a metered usage-based pricing tier for our B2B SaaS analytics product",
  "strengths": [
    "Existing usage-metering pipeline already instruments every API call, so billing hooks require no new telemetry",
    "Current customer base includes several accounts asking for pay-as-you-go pricing in the last two quarters",
    "Engineering team has prior experience shipping Stripe metered-billing integrations from a previous product"
  ],
  "weaknesses": [
    "No self-serve billing portal exists yet — all plan changes currently require a manual sales-ops ticket",
    "Finance has not validated revenue-recognition treatment for usage-based contracts under ASC 606"
  ],
  "opportunities": [
    "Two of our top three competitors still only offer flat-rate annual contracts, leaving usage-based pricing as a differentiator",
    "Usage-based pricing could unlock smaller accounts currently priced out by the $2,000/month minimum flat tier",
    "Expansion revenue naturally grows with customer usage without a separate upsell motion"
  ],
  "threats": [
    "Usage-based billing introduces revenue unpredictability that could concern the board ahead of the next fundraising round",
    "A poorly designed metering unit (e.g., API calls vs. rows processed) could incentivize customers to architect around our pricing"
  ],
  "recommendation": "Proceed with a limited beta of the metered tier for 5-10 design-partner accounts, gated on finance sign-off on ASC 606 treatment, before building the self-serve billing portal."
}
